{  
  "$schema":"http://json-schema.org/draft-07/schema#",
  "title":"GAMS configuration file schema",
  "description":"Configuration file is automatically generated by GAMS and includes model specific data.",
  "type":"object",
  "additionalProperties":false,
  "properties":{  
    "pageTitle":{  
      "description":"Name of the page (displayed in browser tab)",
      "type":"string",
      "default":"GAMS WebUI",
      "required":false
    },
    "MIROSwitch":{  
      "description":"GAMS command line option to trigger the model to work under MIRO",
      "type":"string",
      "minLength":5,
      "required":true
    },
    "fileExchange":{  
      "description":"Method used to exchange files",
      "type":"string",
      "enum":[  
        "csv"
      ],
      "default":"csv",
      "required":false
    },
    "csvDelim":{  
      "description":"Column delimiter for csv files",
      "type":"string",
      "enum":[  
        ",",
        ";"
      ],
      "default":",",
      "required":false
    },
    "gamsInputFiles":{  
      "description":"Name of GAMS input data sheets. Identifiers are case insensitive.",
      "type":"object",
      "additionalProperties":{  
        "type":"object",
        "additionalProperties":false,
        "properties":{  
          "alias":{  
            "type":"string",
            "minLength":1
          },
          "symnames":{ 
            "description": "Symbol names in scalar tables",
            "type":"array",
            "minItems":1,
            "uniqueItems":true,
            "items":{
              "type":"string",
              "minLength":1
            }
          },
          "symtypes":{ 
            "description": "Symbol types in scalar tables",
            "type":"array",
            "minItems":1,
            "items":{
              "type":"string",
              "enum":["set","parameter"],
              "minLength":1
            }
          },
          "symtext":{ 
            "description": "Symbol aliases (exp. text) in scalar tables",
            "type":"array",
            "minItems":1,
            "items":{
              "type":"string",
              "minLength":1
            }
          },
          "headers":{  
            "description":"headers of the input sheets containing names of sets/parameters",
            "type":"object",
            "minProperties":1,
            "additionalProperties":{  
              "type":"object",
              "properties":{
                "alias":{  
                  "description":"Explanatory text of the header symbol",
                  "type":"string",
                  "minLength":1,
                  "required":true
                },
                "type":{  
                  "description":"GAMS input type",
                  "type":"string",
                  "enum":[  
                    "set",
                    "parameter",
                    "acronym",
                    "scalar"
                  ],
                  "required":true
                }
              }
            }
          }
        },
        "required":["headers"]
      }
    },
    "gamsOutputFiles":{  
      "description":"Name of GAMS input data sheets. Identifiers are case insensitive.",
      "type":"object",
      "minProperties":1,
      "additionalProperties":{  
        "type":"object",
        "additionalProperties":false,
        "properties":{  
          "alias":{  
            "type":"string",
            "minLength":1
          },
          "symnames":{ 
            "description": "Symbol names in scalar tables",
            "type":"array",
            "minItems":1,
            "uniqueItems":true,
            "items":{
              "type":"string",
              "minLength":1
            }
          },
          "symtypes":{ 
            "description": "Symbol types in scalar tables",
            "type":"array",
            "minItems":1,
            "items":{
              "type":"string",
              "enum":["set","parameter"],
              "minLength":1
            }
          },
          "symtext":{ 
            "description": "Symbol aliases (exp. text) in scalar tables",
            "type":"array",
            "minItems":1,
            "items":{
              "type":"string",
              "minLength":1
            }
          },
          "count":{  
            "description":"Only relevant for output scalars. Number of scalars in dataframe.",
            "type":"integer",
            "minimum":1,
            "required":false
          },
          "headers":{  
            "description":"headers of the output sheets containing names of sets/parameters",
            "type":"object",
            "minProperties":1,
            "additionalProperties":{  
              "type":"object",
              "properties":{  
                "type":{  
                  "description":"GAMS type",
                  "type":"string",
                  "enum":[  
                    "set",
                    "parameter",
                    "acronym",
                    "scalar"
                  ],
                  "required":true
                }
              }
            }
          }
        }
      }
    }
  }
}
