{
    "pageTitle": "A Transportation Problem (TRNSPORT,SEQ=1)",
    "MIROSwitch": "MIRO=RUN",
    "fileExchange": "csv",
    "csvDelim": ",",
    "gamsInputFiles": {},
    "gamsOutputFiles": {
        "gantt": {
            "alias": "asdasd",
            "headers": {
                "id": {
                    "type": "set",
                    "alias": "gannt_id"
                },
                "start": {
                    "type": "set",
                    "alias": "gannt_start"
                },
                "end": {
                    "type": "set",
                    "alias": "gannt_end"
                },
                "content": {
                    "type": "set",
                    "alias": "gannt_content"
                },
                "group": {
                    "type": "set",
                    "alias": "gantt_group"
                },
                "value": {
                    "type": "parameter",
                    "alias": "asdasd"
                }
            }
        }
    }
}